{
	"id": "PointOfInterest-SHOP:75531",
	"type": "Shop",
	"name": "H & M",
	"description": "Boutique de prêt à porter",
	"url" : "http://www.hm.com/fr",
	"faxNumber" : "0 805 08 88 65",
	"telephone" : "+33(0)8 05 08 88 88",
	"email": "sav@hm.fr",
	"paymentAccepted":["1", "2", "3"],
	"address": {
		"addressCountry": "FR",
		"streetAddress": "455 Promenade des anglais"
	},
	"category" : ["9", "5", "6"] ,
	"alternateName" : "",
	"shopType" : ["droguerie","cremerie"],
	"accessType": ["privateVehicle", "onFoot", "publicTransport"],
	"location": {
		"type": "Point",
		"coordinates": [
			43.6994,
			7.26831
			]
	},
	"source": null,
	"refSeeAlso": ["Shopping-NCA-6587"],
	"image" : "http://www.nicetourisme.com/public/resources/ref/entries/75531/gallery/h-m_172416.jpg",
	"openingHours": "10:00-19:30 - 11:00-19:00 (dimanche)",
	"dateModified": "2016-07-05 10:30:43",
	"dateCreated": "2015-08-24 12:11:38"
}